title,topic,source_name,date,hour,day_of_week,compound,sentiment_label
"'It's Nice To Get Over The Hump And Play For The Stanley Cup': Staal, Martinook, Aho, Hall, Stankoven, Blake, RBA On Advancing To Stanley Cup Final",business,The Hockey News,2026-05-30,8,Saturday,0.6369,Positive
Blenderbros – Ultimate guide to Plasticity,business,Cgpersia.com,2026-05-30,8,Saturday,0.0,Neutral
Replenish Nutrients: Market Has Yet to Price in the H2 2026 Capacity and Licensing Inflection,business,PRNewswire,2026-05-30,8,Saturday,0.0,Neutral
California Dems Take Action to Impede Reporting Crime [semi-satire],business,Freerepublic.com,2026-05-30,8,Saturday,-0.5423,Negative
"Zara posts weakest performance in India since pandemic, net sales fall 1% in FY26",business,The Times of India,2026-05-30,8,Saturday,-0.5106,Negative
25 best places to eat for cheap across Maine,business,Press Herald,2026-05-30,8,Saturday,0.6369,Positive
Qatar Says Temporary Toll at Strait of Hormuz Is Negotiable,business,Financial Post,2026-05-30,8,Saturday,0.0,Neutral
"Raise defence spending or else, Hegseth tells NATO, Europe",business,The Times of India,2026-05-30,8,Saturday,0.1027,Positive
'It became my latest fixation': The wrinkle young workers can't stop thinking about,business,Business Insider,2026-05-30,8,Saturday,0.2235,Positive
Social media bans for kids won’t replace platform safety — United Nations,business,The Punch,2026-05-30,8,Saturday,0.6808,Positive
Wembley 99: Untold Stories,business,Manchester City FC,2026-05-30,8,Saturday,0.0,Neutral
"He dropped out of school, failed at a grocery shop in Jabalpur, and is now a billionaire at the Burj Khalifa. Who is Desi Bling star Satish Sanpal?",business,The Times of India,2026-05-30,8,Saturday,-0.5106,Negative
"Henry Schein Sees Steady Dental Demand, $125M Profit Lift by 2026",business,MarketBeat,2026-05-30,8,Saturday,0.34,Positive
"How war, tariffs and weather 'conspired' to make your tomatoes cost more",business,CBC News,2026-05-30,8,Saturday,-0.5994,Negative
The CEO Job Is Easy. Just Ask a CEO.,business,pymnts.com,2026-05-30,8,Saturday,0.4404,Positive
"Why you MUST tell your doctor about your itchy groin: It's the symptom so many patients are too embarrassed to ask about but this is why you can't ignore it... and how to deal with it for good, writes DR ELLIE",health,Dailymail.com,2026-05-30,10,Saturday,0.6387,Positive
Israel launches more than 10 strikes across southern Lebanon,health,Al Jazeera English,2026-05-30,10,Saturday,-0.4144,Negative
Prosta Peak: A Natural Approach to Prostate Health Support,health,Tumblr.com,2026-05-30,10,Saturday,0.6369,Positive
Scotland v Curacao: Confirmed line-ups for pre-World Cup friendly,health,101 Great Goals,2026-05-30,10,Saturday,0.4939,Positive
Links 5/30/2026,health,Nakedcapitalism.com,2026-05-30,10,Saturday,0.0,Neutral
Dust storms can negatively affect your ENT health,health,YouTube,2026-05-30,10,Saturday,0.0,Neutral
I Tried 5 Blood Sugar Hacks — Here’s What Worked According To My CGM,health,mindbodygreen.com,2026-05-30,10,Saturday,0.0,Neutral
Kirkham Community Garden supports mental health,health,yorkregion.com,2026-05-30,10,Saturday,0.3612,Positive
Saiee Manjrekar: Fitness is not about how you look but how you feel every day,health,The Times of India,2026-05-30,10,Saturday,0.1406,Positive
"West Bengal to implement National Health Mission; Centre sanctions ₹2,103 crore",health,BusinessLine,2026-05-30,10,Saturday,0.0,Neutral
W.H.O. Boss Tedros Heads to Congo as Ebola Cases Surge,health,Freerepublic.com,2026-05-30,10,Saturday,0.0,Neutral
Ebola shows how Trump’s health policies are going global — and coming home,health,Salon,2026-05-30,10,Saturday,0.0,Neutral
"Trump Doctor’s Report Drops Late Friday Night — Details 238-Pound 6 ft 3 President’s Health, Cognitive Results",health,Mediaite,2026-05-30,10,Saturday,0.0,Neutral
"WHO chief lands in eastern Congo’s Ituri province, epicenter of Ebola, as outbreak outpaces response",health,seattlepi.com,2026-05-30,10,Saturday,0.0,Neutral
I was 31 when I was diagnosed with motor neurone disease... four years later I can barely walk or talk. These were the first symptoms I ignored,health,Dailymail.com,2026-05-30,10,Saturday,-0.3182,Negative
"Lagos hails residents’ sanitation compliance, promises better waste collection",health,The Punch,2026-05-30,10,Saturday,0.4019,Positive
"Actress Thaddea Graham was left on the doorstep as a baby in China and doesn't know exactly what age she is. But the 'lucky' Bad Sisters and Sex Education star insists: 'I wasn't abandoned, I got a second chance'",health,Dailymail.com,2026-05-30,10,Saturday,0.5676,Positive
Driver dies after SUV crashes on Lagos expressway,health,The Punch,2026-05-30,10,Saturday,0.0,Neutral
Seagate Stock 2026: Buy or Sell as AI Data Storage Boom Drives Record Margins?,health,Ibtimes.com.au,2026-05-30,10,Saturday,0.0,Neutral
This Commonly Tracked Metric May Explain Why Some Brains Age Faster,health,mindbodygreen.com,2026-05-30,10,Saturday,0.0,Neutral
"“No overtures on me to join APC” – Nwankwo, ex health minister - 108 Scoop",health,108scoop.com,2026-05-30,10,Saturday,0.4215,Positive
"WHO chief lands in eastern Congo’s Ituri province, epicenter of Ebola, as outbreak outpaces response",health,Associated Press,2026-05-30,10,Saturday,0.0,Neutral
Escalating tensions at Newark migrant prison draws ire of lawmakers,health,Salon,2026-05-30,10,Saturday,-0.7184,Negative
A study reveals that the number of words people speak daily has decreased,health,Gossiplankanews.com,2026-05-30,10,Saturday,0.0772,Positive
"Cleveland Browns news (5/30): Hello, Mr. Bond; smart moves and easy options",health,Dawgs By Nature,2026-05-30,10,Saturday,0.6808,Positive
Gen Z is rejecting $200 dates and choosing ‘solo-maxxing’—and dating apps are taking a hit,health,Fortune,2026-05-30,10,Saturday,-0.4588,Negative
HeartFocus Link adds AI cardiac imaging to any hospital ultrasound machine with a tablet and an HDMI cable,health,The Next Web,2026-05-30,10,Saturday,0.0,Neutral
Pixel Vs. Apple Watch: Which Premium Smartwatch Is Best For You?,health,BGR,2026-05-30,10,Saturday,0.6369,Positive
"Parloa turns its $350 million war chest into a partnership web spanning SAP, Microsoft, and OpenAI",health,The Next Web,2026-05-30,10,Saturday,-0.5994,Negative
Why the Protect College Sports Act is the best thing for college sports,health,A Sea Of Blue,2026-05-30,10,Saturday,0.7783,Positive
"'We Wish To Grieve Quietly...': Ajith Kumar's Family Issues FIRST Statement After Mother Mohini Mani's Death, Last Rites To Be Private",health,Free Press Journal,2026-05-30,10,Saturday,-0.5859,Negative
White House Releases Results of Trump’s Latest Physical Exam - The New York Times,health,Slashdot.org,2026-05-30,10,Saturday,0.0,Neutral
"The herb linked to better memory, lower anxiety and Alzheimer’s protection",health,The-independent.com,2026-05-30,10,Saturday,0.0,Neutral
FSSAI sends notice to IRCTC after viral video shows utensils being washed in train toilet,health,The Times of India,2026-05-30,10,Saturday,0.0,Neutral
"Is Amazfit's most premium smartwatch worth it? I tested it on the golf course, and it paid off",health,ZDNet,2026-05-30,10,Saturday,0.2878,Positive
‘Flopping and Disrespect’: Criticism mounts for Caitlin Clark’s ‘tantrums’,health,The Comeback,2026-05-30,10,Saturday,-0.4404,Negative
"Older Adults Need To Exercise This One Muscle Group, According To Physical Therapists",health,HuffPost,2026-05-30,10,Saturday,0.0,Neutral
Republicans want to make the Texas Senate race about manliness,health,Salon,2026-05-30,10,Saturday,0.0772,Positive
Kenya’s Ksh 300B U.S. Health Deal Under Scrutiny Amid Ebola Facility Uproar,health,Kenyans.co.ke,2026-05-30,10,Saturday,0.0,Neutral
Fitbit Air vs. Oura Ring: Wrist or Finger for the Future of Wellness?,health,PCMag.com,2026-05-30,10,Saturday,0.4404,Positive
A guide to the (many) groups running Alberta's separatist and remain camps,health,CBC News,2026-05-30,10,Saturday,0.0,Neutral
Today on Pinstripe Alley – 5/30/26,health,Pinstripe Alley,2026-05-30,10,Saturday,0.0,Neutral
Apocalyptic “Fungal Storms” Are Now Surging Across the US,health,Futurism,2026-05-30,10,Saturday,-0.6597,Negative
How Riccio Pharmacy Makes Online Medicine Delivery Easier For Patients?,health,GlobeNewswire,2026-05-30,10,Saturday,0.4215,Positive
"ICYMI: the 8 biggest tech stories of the week, from Oura's new smart ring to the Pope's take on AI",health,TechRadar,2026-05-30,10,Saturday,0.4019,Positive
Trump's doctor reveals President's biological age after saying he's in 'excellent health' following exam,health,LADbible,2026-05-30,9,Saturday,0.5719,Positive
"Trump in excellent health after annual checkup, doctor says - BBC",health,Slashdot.org,2026-05-30,9,Saturday,0.5719,Positive
I Run a Summer Camp. I Have One Piece of Advice for Parents Nervous About Sending Their Kids.,health,Slate Magazine,2026-05-30,9,Saturday,-0.2732,Negative
Nepal Tourism Promotion Program held in Bangkok,health,Khabarhub.com,2026-05-30,9,Saturday,0.0,Neutral
Survey reveals 50% of users don’t like the new Google Health app,health,Android Authority,2026-05-30,9,Saturday,0.3612,Positive
"LAWMA projects 5,000 jobs from recycling facilities",health,The Punch,2026-05-30,9,Saturday,0.0,Neutral
Depression May Not Affect Every Brain In The Same Way,health,mindbodygreen.com,2026-05-30,9,Saturday,-0.5719,Negative
"7 Japanese memory techniques people use to remember more, from train operators to mental-abacus experts",health,The Times of India,2026-05-30,9,Saturday,0.0,Neutral
Blizzard Releases StarCraft 2 Patch 5.0.16 to Public Test Realm Six Years After Content Development Ended,health,Ghacks Technology News,2026-05-30,9,Saturday,0.0,Neutral
Laos: Five people rescued from flooded cave,health,DW (English),2026-05-30,9,Saturday,0.4215,Positive
"Trump in excellent health with leg swelling, hand bruising, doctor says - Reuters",health,Slashdot.org,2026-05-30,9,Saturday,0.7845,Positive
"Trump remains in excellent health despite leg swelling, hand bruising, White House memo says",health,CBC News,2026-05-30,9,Saturday,0.2668,Positive
"In the 1940s, Harold Ridley noticed plastic splinters sitting quietly in pilots’ eyes, and it wasn’t just wartime debris: It changed cataract surgery",health,The Times of India,2026-05-30,9,Saturday,0.0,Neutral
New Research Challenges What We Thought About Sleeping In,health,mindbodygreen.com,2026-05-30,9,Saturday,0.0772,Positive
Trump declared 'fully fit' for all presidential duties after annual physical shows 'excellent health',health,Fox News,2026-05-30,9,Saturday,0.7574,Positive
Your Cycle Has Been Telling You Something For Years — Researchers Explain,health,mindbodygreen.com,2026-05-30,9,Saturday,0.0,Neutral
Study unveils aggressive tobacco marketing targeting young African...,health,Vmtnews.ng,2026-05-30,9,Saturday,-0.1531,Negative
From clinics to clicks: Internet emerges as ‘second doctor’ for confused patients,health,The Times of India,2026-05-30,9,Saturday,-0.3182,Negative
brainpalace-rag added to PyPI,health,Pypi.org,2026-05-30,9,Saturday,0.0,Neutral
The Migraine Symptom That Could Signal A Bigger Health Risk,health,mindbodygreen.com,2026-05-30,9,Saturday,-0.2732,Negative
"What Longevity Bro Influencers Get Wrong About Women, According To MDs",health,mindbodygreen.com,2026-05-30,9,Saturday,-0.4767,Negative
Repairing DNA damage: Scientists discover a surprising new benefit of melatonin,health,Science Daily,2026-05-30,9,Saturday,0.2263,Positive
Motorola cell phone: Speaker with 88 decibels but hardly any bass,health,Notebookcheck.net,2026-05-30,9,Saturday,0.0,Neutral
Samsung Galaxy Z Roll 5G Leaks: A 12.4-Inch Motorized Screen and 324MP Camera?,health,Geeky Gadgets,2026-05-30,9,Saturday,0.0,Neutral
"Gounder Gives Lowdown on Ebola, Peptides, and Colorectal Screenings",health,Kffhealthnews.org,2026-05-30,9,Saturday,-0.2023,Negative
You Wouldn’t Believe That “Quantum Energy” Works Until You Hear This & See THESE Photos.,health,Omny.fm,2026-05-30,9,Saturday,0.0,Neutral
This Daily Habit May Support Healthier Blood Pressure In Just 20 Days,health,mindbodygreen.com,2026-05-30,9,Saturday,0.128,Positive
This Overlooked Nutrient May Help Ease Knee Osteoarthritis Pain,health,mindbodygreen.com,2026-05-30,9,Saturday,0.2023,Positive
These “Feel-Good” Activities Were Linked To Slower Aging At The DNA Level,health,mindbodygreen.com,2026-05-30,9,Saturday,0.0,Neutral
How three major candidates for governor are talking about their Biden administration experience,health,NBC News,2026-05-30,9,Saturday,0.0,Neutral
"'He was a changed person': Clinton Ellison, survivor of Portapique mass shooting, dies",health,CBC News,2026-05-30,9,Saturday,0.3612,Positive
Watsonville Community Hospital awarded $10.6 million in emergency relief funds from state,health,Santa Cruz Sentinel,2026-05-30,8,Saturday,0.4939,Positive
Could Champions League Final Be Arsenal’s Greatest-Ever Night?,health,Forbes,2026-05-30,8,Saturday,0.5267,Positive
Psychology suggests people who step outside to breathe before answering aren't being dramatic - they're protecting the pause that lets emotion settle before words do damage,health,The Times of India,2026-05-30,8,Saturday,-0.4939,Negative
"​Psychology suggests people who arrive ten minutes early to everything aren't overprepared - they're using a small buffer to keep stress from deciding the mood of the day, because time pressure narrows how calmly people can think",health,The Times of India,2026-05-30,8,Saturday,-0.4019,Negative
One UI 9 Watch beta may be around the corner with smarter AI and health upgrades - SamMobile,health,Slashdot.org,2026-05-30,8,Saturday,0.4588,Positive
"Maternal mortality falls from 1,025 to 570 in Kano, says official",health,The Punch,2026-05-30,8,Saturday,0.0,Neutral
The Rumour Mill - Close Season Week 1,health,Toffeeweb,2026-05-30,8,Saturday,0.0,Neutral
Ferrari’s former chairman called the Luce a disgrace. Italy’s transport minister piled on. The stock dropped 8%.,health,The Next Web,2026-05-30,8,Saturday,-0.4939,Negative
Malta votes in snap parliamentary election,health,DW (English),2026-05-30,8,Saturday,0.0,Neutral
"Australian flotilla participants join ICC case, alleging abuse in Israeli custody",health,SBS News,2026-05-30,8,Saturday,-0.4588,Negative
Yankees give Jose Caballero start at shortstop in win over A’s,health,New York Post,2026-05-30,8,Saturday,0.5859,Positive
An AI CEO explains how much he spent on Codex last month — and why he's still 'very nice' when prompting the tech,health,Business Insider,2026-05-30,8,Saturday,0.4754,Positive
"Recent dog attacks in central Newfoundland not necessarily sign of growing trend, say police",health,CBC News,2026-05-30,8,Saturday,-0.296,Negative
Kyabugimbi Health Centre IV Upgrade to District Hospital Launched in Bushenyi,health,Westernpearlreports.com,2026-05-30,8,Saturday,0.128,Positive
Links 5/30/2026,science,Nakedcapitalism.com,2026-05-30,10,Saturday,0.0,Neutral
Woman Accuses Biohacker Bryan Johnson of Hypocrisy to His Face,science,Futurism,2026-05-30,10,Saturday,-0.34,Negative
New 3D silicon chip breakthrough could extend Moore’s Law for years,science,Science Daily,2026-05-30,10,Saturday,0.1779,Positive
"Quote of the day by Steven Spielberg: 'Everything has to start with fear. Loss, loneliness, being challenged and pursued by big forces...'; Jaws, Schindler's List, Jurassic Park director explains why fear and loneliness can shape personal growth",science,The Times of India,2026-05-30,10,Saturday,-0.9022,Negative
Scientists issue stark warning as 'Doomsday Glacier’ size of Britain could collapse this year,science,LADbible,2026-05-30,10,Saturday,-0.8555,Negative
"the hummingbird-red flower connection, with harvard’s patrick mckenzie",science,Awaytogarden.com,2026-05-30,10,Saturday,0.0,Neutral
"The herb linked to better memory, lower anxiety and Alzheimer’s protection",science,The-independent.com,2026-05-30,10,Saturday,0.0,Neutral
Quilts Are Better Than Sleeping Bags,science,Wired,2026-05-30,10,Saturday,0.4404,Positive
This Trump-linked startup plans to put humanoid robots in the military,science,CNBC,2026-05-30,10,Saturday,0.0,Neutral
The best new science-fiction books of June 2026,science,New Scientist,2026-05-30,10,Saturday,0.6369,Positive
Weekend reads: White House proposal prohibits federal funds for APCs; sleuths say Thermo Fisher doctored data; sleuth in China takes to social media,science,Retractionwatch.com,2026-05-30,10,Saturday,0.0,Neutral
NASA’s Hubble captures gorgeous new photo of a spiral galaxy as it wanders through the Virgo Cluster,science,Scientific American,2026-05-30,10,Saturday,0.6124,Positive
James Talarico’s desperate drive to detransition from his woke past,science,New York Post,2026-05-30,10,Saturday,-0.3182,Negative
Weekend Reading 5.30.26,science,thestripe.com,2026-05-30,10,Saturday,0.0,Neutral
Apocalyptic “Fungal Storms” Are Now Surging Across the US,science,Futurism,2026-05-30,10,Saturday,-0.6597,Negative
CSIR CEERI Recruitment 2026: Vacancies announced for 22 posts- here's the link to apply,science,The Times of India,2026-05-30,9,Saturday,0.0,Neutral
"Natural Selection Explained: Darwin, Adaptation and Evolution",science,Arkinspace.com,2026-05-30,9,Saturday,0.3612,Positive
"7 Japanese memory techniques people use to remember more, from train operators to mental-abacus experts",science,The Times of India,2026-05-30,9,Saturday,0.0,Neutral
Does Caffeine Work Differently For Women? What New Research Shows,science,mindbodygreen.com,2026-05-30,9,Saturday,0.0,Neutral
"In the 1940s, Harold Ridley noticed plastic splinters sitting quietly in pilots’ eyes, and it wasn’t just wartime debris: It changed cataract surgery",science,The Times of India,2026-05-30,9,Saturday,0.0,Neutral
"What Longevity Bro Influencers Get Wrong About Women, According To MDs",science,mindbodygreen.com,2026-05-30,9,Saturday,-0.4767,Negative
How Elsa Morrison became the catcher each Tennessee softball pitcher needed,science,Knoxville News Sentinel,2026-05-30,9,Saturday,0.0,Neutral
This Daily Habit May Support Healthier Blood Pressure In Just 20 Days,science,mindbodygreen.com,2026-05-30,9,Saturday,0.128,Positive
You Wouldn’t Believe That “Quantum Energy” Works Until You Hear This & See THESE Photos.,science,Omny.fm,2026-05-30,9,Saturday,0.0,Neutral
Millions of Bees Have Thrived Under a New York Cemetery for More Than a Century,science,Wired,2026-05-30,9,Saturday,0.0,Neutral
What it means to be a man is a theme in Texas Senate race as Paxton attacks Talarico,science,NPR,2026-05-30,9,Saturday,-0.4404,Negative
Psychology suggests people who step outside to breathe before answering aren't being dramatic - they're protecting the pause that lets emotion settle before words do damage,science,The Times of India,2026-05-30,8,Saturday,-0.4939,Negative
SPA DOCTOR: I thought being a 'golf widow' sounded miserable - then a luxury Moroccan resort proved me wrong,science,Dailymail.com,2026-05-30,8,Saturday,-0.743,Negative
A wind farm in Poland became so loud that local birds started singing louder to compete with the noise,science,The Times of India,2026-05-30,8,Saturday,0.0,Neutral
"Exclusive-Better China ties can help regional peace, security, Vietnam's top leader says",science,Yahoo Entertainment,2026-05-30,8,Saturday,0.8555,Positive
"The longest-running laboratory experiment in the world began at the University of Queensland in 1927, a funnel of pitch that drips roughly once a decade, and in nearly a century no human has ever actually witnessed a drop fall",science,Space Daily,2026-05-30,8,Saturday,-0.4939,Negative
"Henry Schein Sees Steady Dental Demand, $125M Profit Lift by 2026",science,MarketBeat,2026-05-30,8,Saturday,0.34,Positive
Indonesia pushes innovation-led downstreaming for palm oil gains,science,Antaranews.com,2026-05-30,7,Saturday,0.34,Positive
"Hawaiians spotted sea turtles with mysterious 'graffiti' on their backs, and it sparked a 600-person mission to save the species",science,The Times of India,2026-05-30,7,Saturday,0.4588,Positive
This strange new phase of matter could transform quantum technology,science,Science Daily,2026-05-30,7,Saturday,-0.1779,Negative
The Best Compact Camera For Everyday Use in 2026,science,Canonrumors.com,2026-05-30,7,Saturday,0.6369,Positive
Why Women Need Testosterone: The Truth About Hormone Health,science,Mybodytonic.com,2026-05-30,7,Saturday,0.3182,Positive
Robinhood Markets Bets on Agentic AI Trading as Assets Climb to $350 Billion,science,MarketBeat,2026-05-30,7,Saturday,0.1779,Positive
"OpenAI has launched a massive $4 billion corporate engineering initiative called ""DeployCo"" to embed elite developers directly into global banks and enterprises",science,Maketecheasier.com,2026-05-30,7,Saturday,0.128,Positive
Photons behave very strangely if you try to cut them,science,New Scientist,2026-05-30,7,Saturday,-0.5563,Negative
Rwanda-Russia nuclear deal underscores Africa’s shifting power balance,science,Al Jazeera English,2026-05-30,6,Saturday,0.0,Neutral
"The Sun might look yellow, but seen from space without an atmosphere filtering its light, the sun is actually white — and the yellow color we see from Earth is the result of our atmosphere scattering blue wavelengths away, in the same physics that makes the sky appear blue",science,Space Daily,2026-05-30,6,Saturday,0.0,Neutral
What is a blue micromoon? #science,science,Alltoc.com,2026-05-30,6,Saturday,0.0,Neutral
How do fog droplets host bacteria? #science,science,Alltoc.com,2026-05-30,6,Saturday,0.0,Neutral
What did Alzheimer’s origins study find? #science,science,Alltoc.com,2026-05-30,6,Saturday,0.0,Neutral
How do wall lizards escape a bottleneck? #science,science,Alltoc.com,2026-05-30,6,Saturday,0.1779,Positive
Science reveals seven to nine hours of sleep could be the key to preventing dementia,science,Naturalnews.com,2026-05-30,6,Saturday,-0.0258,Neutral
"Leafy greens offer multiple pathways for blood pressure control, research shows",science,Naturalnews.com,2026-05-30,6,Saturday,-0.296,Negative
Big Toothpasteâs dirty secret: 90% of brands contain cancer-causing heavy metals,science,Naturalnews.com,2026-05-30,6,Saturday,-0.4404,Negative
Study Suggests Vegan Diet May Impede Self-Healing,science,Naturalnews.com,2026-05-30,6,Saturday,0.0,Neutral
"Your brain's 'night shift': How sleep clears 'waste,' may protect against dementia",science,Medical News Today,2026-05-30,5,Saturday,0.0258,Neutral
This tomato-soy juice reduced inflammation in just four weeks,science,Science Daily,2026-05-30,5,Saturday,0.0,Neutral
To Gen or Not To Gen: The Ethical Use of Generative AI - My Not So Private Tech Life,science,Johanneslink.net,2026-05-30,5,Saturday,0.5106,Positive
(3) Summary of Key Changes in OMB’s Proposed Federal Financial Assistance Rule,science,Substack.com,2026-05-30,5,Saturday,0.0,Neutral
Gardeners World S59E11 1080p WEB-DL H264-W45Ps,science,Rlsbb.to,2026-05-30,5,Saturday,0.0,Neutral
"The Pacific Ocean is so vast that it’s larger than every continent on Earth combined — and there’s a single straight line you could sail through it for nearly 20,000 miles without ever touching land",science,Space Daily,2026-05-30,5,Saturday,0.2263,Positive
Stanford quantum computing breakthrough uses twisted light to work without extreme cooling,science,Science Daily,2026-05-30,5,Saturday,0.0,Neutral
Gardaí enlist international help to identify DNA found in Sophie Toscan du Plantier murder investigation,science,The Irish Times,2026-05-30,5,Saturday,-0.4588,Negative
Emily O’Reilly: My brother’s HIV seemed under control. So why did he die?,science,The Irish Times,2026-05-30,5,Saturday,-0.5994,Negative
"Climate Change Weekly # 581— It’s Hurricane Season, and Nothing Is New",science,Wattsupwiththat.com,2026-05-30,5,Saturday,0.0,Neutral
What happens to Bloom’s show gardens when the festival is over?,science,The Irish Times,2026-05-30,5,Saturday,0.4939,Positive
tidypolars4sci 0.0.1.23,science,Pypi.org,2026-05-30,4,Saturday,0.0,Neutral
tools4sci 0.0.1.5,science,Pypi.org,2026-05-30,4,Saturday,0.0,Neutral
TN govt to continue free bus pass scheme for students,science,BusinessLine,2026-05-30,4,Saturday,0.5106,Positive
"Prabowo-Macron talks strengthen cooperation in education, research",science,Antaranews.com,2026-05-30,4,Saturday,0.3182,Positive
"A day on Earth is described as 24 hours, but the planet has been slowing down for billions of years — and growth rings in ancient coral fossils show that 380 million years ago, hundreds of millions of years before any dinosaur existed, an Earth day was only about 22 hours long",science,Space Daily,2026-05-30,4,Saturday,0.5267,Positive
"More than 550,000 students reached through Microsoft Stem and artificial intelligence programme",science,The Irish Times,2026-05-30,4,Saturday,0.5423,Positive
Will AI become conscious? What a philosopher and a neuroscientist think,science,ABC News (AU),2026-05-30,3,Saturday,0.0,Neutral
"Blue Moon May 31, 2026: Will this rare lunar event be visible in India? When, where & how to watch it; What it means for zodiac signs, and how it differs from Supermoon",science,The Times of India,2026-05-30,3,Saturday,0.0,Neutral
"Don Lincoln: The quest for unification in physics, how Newton linked celestial and terrestrial gravity, and the pivotal role of electromagnetism in technology | Lex Fridman Podcast",science,Crypto Briefing,2026-05-30,3,Saturday,0.0,Neutral
Army chief General Upendra Dwivedi reviews NDA's 150th passing out parade in Pune,science,The Times of India,2026-05-30,3,Saturday,0.0,Neutral
"The Sahara is usually depicted as the world’s largest desert, but because a desert is defined by rainfall rather than temperature, the entire continent of Antarctica is technically the largest desert on Earth, with parts of its interior having received no significant precipitation for nearly 14 million years",science,Space Daily,2026-05-30,3,Saturday,-0.2235,Negative
