title,topic,source_name,date,hour,day_of_week,compound,sentiment_label
"The Sahara is usually described as the world’s largest desert, but because a desert is defined by rainfall rather than temperature, the entire continent of Antarctica is technically the largest desert on Earth, with parts of its interior having received no significant precipitation for nearly 14 million years",science,Space Daily,2026-05-30,3,Saturday,-0.2235,Negative
The Beginning Comes after the End by Rebecca Solnit: Renewal in a time of despair,science,The Irish Times,2026-05-30,3,Saturday,-0.3182,Negative
NYT Connections Answers May 30 2026 Revealed for Puzzle 1084 with Clever Categories,science,Ibtimes.com.au,2026-05-30,3,Saturday,0.4588,Positive
Absolute Green Lantern #15 Preview: Jo's Cosmic Road Trip Gone Wrong,science,Bleeding Cool News,2026-05-30,3,Saturday,-0.4767,Negative
Why AA matters more than stock selection for multi-generational wealth,science,Livemint,2026-05-30,3,Saturday,0.5106,Positive
"Ethereum Price Falls, But Whales Push Holdings To 10-Week High",science,newsBTC,2026-05-30,3,Saturday,0.0,Neutral
Valis - Kief Science Session,science,Dnbradio.com,2026-05-30,2,Saturday,0.0,Neutral
"Clive Davis, 94, hospitalized in New York... just DAYS after attending starry event with Alicia Keys",science,Dailymail.com,2026-05-30,2,Saturday,0.0,Neutral
Lauren Sanchez Bezos flashes trademark grin while clinging to husband Jeff at her daughter's graduation... just hours before Blue Origin rocket exploded in huge fireball,science,Dailymail.com,2026-05-30,2,Saturday,0.6597,Positive
"Antoine Semenyo, Ghana's World Cup star who defied rejection",science,Yahoo Entertainment,2026-05-30,2,Saturday,-0.5423,Negative
A Closer Look At The Damage To New Glenn's Launch Pad,science,Freerepublic.com,2026-05-30,2,Saturday,-0.4939,Negative
"Bioma Probiotics Claims Evaluated: What the 2026 Gut Health Research Reveals About This Seed Probiotics Alternative, Its Ingredients, Weight Loss Support, and Consumer Reviews",science,GlobeNewswire,2026-05-30,2,Saturday,0.1027,Positive
"8 Years Later, Crunchyroll’s Major Shonen jump Series Unveils First Look At Finale",science,ComicBook.com,2026-05-30,1,Saturday,0.0,Neutral
Brendan Fraser's New WWII Movie Gives A Radically Different Look At D-Day & A US President,science,Screen Rant,2026-05-30,1,Saturday,0.0,Neutral
Mars's manganese 'bathtub ring' reveals ancient ocean timeline and its potential for life - Phys.org,science,Slashdot.org,2026-05-30,1,Saturday,0.0,Neutral
Smith Jerrod Is Moving to Costa Rica,science,Vulture,2026-05-30,1,Saturday,0.0,Neutral
Trump directs CDC to align with assessment calling for fewer childhood vaccines,science,CBS News,2026-05-30,1,Saturday,0.0,Neutral
How Claytronics Will Redefine Co-Creation and Experience Design,science,Bradenkelley.com,2026-05-30,1,Saturday,0.0,Neutral
Q&A with Gen. Frank Donovan,science,Defense One,2026-05-30,1,Saturday,0.0,Neutral
Pressure Causes Temperature? It’s Time to Climb Down from “Mount Stupid”,science,Wattsupwiththat.com,2026-05-30,1,Saturday,-0.296,Negative
"Equity, social justice launched me into medical career — Canada-based paediatric surgeon",science,The Punch,2026-05-30,0,Saturday,0.5994,Positive
Women’s empowerment key to nation-building: President Paudel,science,Khabarhub.com,2026-05-30,0,Saturday,0.0,Neutral
MAVEN Spacecraft Finds New Plasma Squeezing at Mars,science,Universe Today,2026-05-30,0,Saturday,0.0,Neutral
Malicious npm packages abuse dependency confusion to profile developer environments,science,Microsoft.com,2026-05-30,0,Saturday,-0.7506,Negative
How can fog droplets remove pollutants? #science,science,Alltoc.com,2026-05-30,0,Saturday,0.0,Neutral
Air pollution slows lung growth UK study #science,science,Alltoc.com,2026-05-30,0,Saturday,0.3818,Positive
"Indiana Fever vs. Portland Fire: How to watch Caitlin Clark's next game tonight, time, channel and more",sports,Yahoo Entertainment,2026-05-30,10,Saturday,-0.34,Negative
2 soccer players and a betting agent receive prison terms for match-fixing in Hong Kong,sports,Yahoo Entertainment,2026-05-30,10,Saturday,-0.5106,Negative
"PSG vs. Arsenal: Preview, Predictions and Lineups - Sports Illustrated",sports,Slashdot.org,2026-05-30,10,Saturday,0.0,Neutral
"Where to watch Toluca vs. Tigres live stream, TV channel, start time for CONCACAF Champions Cup final 2026",sports,Sporting News,2026-05-30,10,Saturday,0.5267,Positive
Kirkham Community Garden supports mental health,sports,yorkregion.com,2026-05-30,10,Saturday,0.3612,Positive
"How to live stream Scotland vs Curaçao: International Soccer Friendlies, TV Channel",sports,The Big Lead,2026-05-30,10,Saturday,0.4939,Positive
"RCB has always been a reflection of Bengaluru itself — resilient, creative, optimistic and endlessly hopeful",sports,The Times of India,2026-05-30,10,Saturday,0.8176,Positive
Driver dies after SUV crashes on Lagos expressway,sports,The Punch,2026-05-30,10,Saturday,0.0,Neutral
"Dublin assault victim was 'glue' of family, funeral told",sports,RTE,2026-05-30,10,Saturday,-0.8126,Negative
Wisconsin Interim AD Announces UW Athletic Hall of Fame Class of 2026,sports,USA Today,2026-05-30,10,Saturday,0.4404,Positive
Stock Market Holidays in June 2026: Check Complete NSE and BSE Closure List | LatestLY,sports,LatestLY,2026-05-30,10,Saturday,0.3818,Positive
Upbeat Music May Help You Work Out Longer,sports,Newser,2026-05-30,10,Saturday,0.4019,Positive
5.31(日)「K-1 REVENGE 2026」前日計量 全選手計量クリアし、サッタリは「自分の中にあるファイアをコントロールします」とコメント,sports,Prtimes.jp,2026-05-30,10,Saturday,-0.6289,Negative
Lexington's Hughes leads area state qualifiers in final home track meet,sports,Mansfield News Journal,2026-05-30,10,Saturday,0.0,Neutral
‘It’s like a dream’: Megan Grant makes history as UCLA dominates Arkansas,sports,The Comeback,2026-05-30,10,Saturday,0.6369,Positive
BetMGM bonus code NYPNEWSGET: Get up to $1K in no-sweat tokens for Arsenal vs. PSG,sports,New York Post,2026-05-30,10,Saturday,0.5423,Positive
Why the Protect College Sports Act is the best thing for college sports,sports,A Sea Of Blue,2026-05-30,10,Saturday,0.7783,Positive
"Naomi Osaka arrives for French Open match in billowing dress as she refuses to back down AGAIN on wearing 'fashion show' outfits, despite infuriating opponent",sports,Dailymail.com,2026-05-30,10,Saturday,0.4168,Positive
Where to watch Texas A&M vs. Texas State in College Station Regional,sports,USA Today,2026-05-30,10,Saturday,0.0,Neutral
Cavaliers make right call with coach Kenny Atkinson's job. Opinion,sports,Akron Beacon Journal,2026-05-30,10,Saturday,0.0,Neutral
"What channel is the NASCAR O'Reilly Series at Nashville on today? Time, TV schedule",sports,Yahoo Entertainment,2026-05-30,10,Saturday,0.0,Neutral
"What channel is the NASCAR O'Reilly Series at Nashville on today? Time, TV schedule",sports,Yahoo Entertainment,2026-05-30,10,Saturday,0.0,Neutral
Which central Ohio softball teams earned OHSAA state berths May 29?,sports,Fci Academy,2026-05-30,10,Saturday,0.0,Neutral
"Cowboys Headlines: Cowboys 2026 roadblock, Prescott's biggest obstacle",sports,USA Today,2026-05-30,10,Saturday,-0.3612,Negative
"Where to watch Dmitry Bivol vs Michael Eifert today: Fight time, streaming info",sports,Tennessean,2026-05-30,10,Saturday,-0.3818,Negative
Three must-watch Wisconsin volleyball matches in 2026,sports,USA Today,2026-05-30,10,Saturday,0.0,Neutral
Want to Watch a James Bond Movie? These Are My Top Picks,sports,CNET,2026-05-30,10,Saturday,0.2732,Positive
Champions League Final: Livestream Arsenal vs. PSG Today,sports,CNET,2026-05-30,10,Saturday,0.5267,Positive
Amy Gaskin: Marilyn Forever! Marilyn Monroe—A Symbol of Hope,sports,Lenscratch.com,2026-05-30,10,Saturday,0.4926,Positive
"Is Amazfit's most premium smartwatch worth it? I tested it on the golf course, and it paid off",sports,ZDNet,2026-05-30,10,Saturday,0.2878,Positive
‘Flopping and Disrespect’: Criticism mounts for Caitlin Clark’s ‘tantrums’,sports,The Comeback,2026-05-30,10,Saturday,-0.4404,Negative
Flopping Is Ethically Fine and Visually Atrocious,sports,New York Magazine,2026-05-30,10,Saturday,0.2023,Positive
Could the unlikely savior of US college sports be … Donald Trump?,sports,Yahoo Entertainment,2026-05-30,10,Saturday,0.0,Neutral
"How to Watch Thunder vs. Spurs Game 7: Channel, Live Stream & Start Time for 2026 NBA Playoffs",sports,NESN,2026-05-30,10,Saturday,0.0,Neutral
"Where to watch Amanda Serrano vs. Cheyenne Hanson: Live stream, TV channel & start time for 2026 boxing fight",sports,Sporting News,2026-05-30,10,Saturday,-0.3818,Negative
The Knicks and the Greatest Night in New York Sports,sports,The New Yorker,2026-05-30,10,Saturday,0.6369,Positive
"Frances Tiafoe vs. Jaime Faria prediction: French Open odds, picks, best bets",sports,New York Post,2026-05-30,10,Saturday,0.6369,Positive
Why Now Is The Time For James Dolan To Sell A Stake In The Knicks,sports,Forbes,2026-05-30,10,Saturday,0.0,Neutral
Arsenal vs. PSG: How to Watch the Champions League Final,sports,Rolling Stone,2026-05-30,10,Saturday,0.5267,Positive
James Talarico’s desperate drive to detransition from his woke past,sports,New York Post,2026-05-30,10,Saturday,-0.3182,Negative
"Kalshi promo code NYPMAX: Trade $10, get $10 for the Champions League Final",sports,New York Post,2026-05-30,10,Saturday,0.5267,Positive
"ICYMI: the 8 biggest tech stories of the week, from Oura's new smart ring to the Pope's take on AI",sports,TechRadar,2026-05-30,10,Saturday,0.4019,Positive
Italy Has Failed to Qualify for Three Straight World Cups. Are the Country’s Immigration Policies to Blame?,sports,The New Yorker,2026-05-30,10,Saturday,-0.5859,Negative
Paramount founder Mohamad Fakih opens up about his feud with Mississauga’s mayor,sports,Toronto Star,2026-05-30,9,Saturday,-0.34,Negative
CSR Weekend Warriors: 5/29-5/31,sports,Cat Scratch Reader,2026-05-30,9,Saturday,0.0,Neutral
Thunder’s Jalen Williams officially ruled out for Game 7 of Western Conference Finals - NBC Sports,sports,Slashdot.org,2026-05-30,9,Saturday,0.0,Neutral
India’s student accommodation market offers $4 billion opportunity by 2028: CBRE,sports,BusinessLine,2026-05-30,9,Saturday,0.4215,Positive
$1.99 | Stillness Is the Key (eBook) by Ryan Holiday (2 replies),sports,Slickdeals.net,2026-05-30,9,Saturday,0.4019,Positive
I Run a Summer Camp. I Have One Piece of Advice for Parents Nervous About Sending Their Kids.,sports,Slate Magazine,2026-05-30,9,Saturday,-0.2732,Negative
Koby Altman looks back and ahead as Cavaliers head into big offseason,sports,Akron Beacon Journal,2026-05-30,9,Saturday,0.0,Neutral
Does Caffeine Work Differently For Women? What New Research Shows,sports,mindbodygreen.com,2026-05-30,9,Saturday,0.0,Neutral
Mike Bianchi: Kyle Busch’s death exposes the ignorance of Stephen A. Smith’s NASCAR rant,sports,Orlando Sentinel,2026-05-30,9,Saturday,-0.8519,Negative
"Neeraj Chopra and Himani Mor's unusual love story, followed by a secret wedding, is straight out of a Bollywood script",sports,The Times of India,2026-05-30,9,Saturday,0.7269,Positive
'A 50/50 shot at our best season ever - process that',sports,BBC News,2026-05-30,9,Saturday,0.6369,Positive
"San Antonio Spurs vs. OKC Thunder: Where to watch Game 7 tonight, time, channel, and more",sports,Yahoo Entertainment,2026-05-30,9,Saturday,0.0,Neutral
High school baseball: Southern Section championship game results and schedule,sports,Yahoo Entertainment,2026-05-30,9,Saturday,0.4404,Positive
"What channel is FSU baseball vs Coastal Carolina on today? Time, TV schedule",sports,Tallahassee Democrat,2026-05-30,9,Saturday,0.0,Neutral
"Scouts, exec assess fair value if Sharks decide to trade 2026 No. 2 overall pick",sports,Nbcsportsbayarea.com,2026-05-30,9,Saturday,0.5719,Positive
Texas Tech signs latest House settlement participant agreement,sports,LubbockOnline.com,2026-05-30,9,Saturday,0.4939,Positive
High school softball: City and Southern Section finals scores and schedule,sports,Yahoo Entertainment,2026-05-30,9,Saturday,0.0,Neutral
"Bayern Munich enter race for Liverpool, Man City and Man United target after missing out on Barcelona's £70m signing Anthony Gordon",sports,Dailymail.com,2026-05-30,9,Saturday,0.1531,Positive
"Adidas and Puma, the bitter rivalry between two brothers",sports,Mrssfeed.com,2026-05-30,9,Saturday,-0.4215,Negative
"What Are 10 Of The Best Dive Watches Under €2,000?",sports,Fratellowatches.com,2026-05-30,9,Saturday,0.6369,Positive
How to watch Scotland vs Curaçao: Free Streams & TV Channels for World Cup 2026 warm-up match,sports,TechRadar,2026-05-30,9,Saturday,0.5106,Positive
This run-down town is the launchpad for the superweapon Putin used to attack Ukraine,sports,Business Insider,2026-05-30,8,Saturday,-0.4767,Negative
Maura Higgins showcases her toned abs in tiny black bralette and figure-hugging skirt as she wows in second stylish look for Sports Illustrated beach club party in Miami,sports,Dailymail.com,2026-05-30,8,Saturday,0.6908,Positive
IMSA Detroit: Cadillac and Corvette sweep front rows,sports,autosport.com,2026-05-30,8,Saturday,0.0,Neutral
Official Weigh-In Results | UFC Macau - UFC.com,sports,Slashdot.org,2026-05-30,8,Saturday,0.0,Neutral
"Oscar Cluff showed he's 'good all-around player' at NBA draft workout, credits Purdue basketball",sports,The Indianapolis Star,2026-05-30,8,Saturday,0.6597,Positive
Sky Sports: Crystal Palace have found their Oliver Glasner replacement and talks are already underway,sports,English Premier League Index - Opta Stats,2026-05-30,8,Saturday,0.0,Neutral
12B SPORTS Named Main Sponsor of VR46 Racing Team for the 2026 MotoGP Season,sports,Financial Post,2026-05-30,8,Saturday,0.0,Neutral
Springfield track meet will raise funds for youth sports access,sports,Yahoo Entertainment,2026-05-30,8,Saturday,0.0,Neutral
12B SPORTS Named Main Sponsor of VR46 Racing Team for the 2026 MotoGP Season,sports,GlobeNewswire,2026-05-30,8,Saturday,0.0,Neutral
Setting a new Score. Bishop Chatard distance runner leaves mark on track and off,sports,The Indianapolis Star,2026-05-30,8,Saturday,0.0,Neutral
Major Ankara stadium project enters final phase,sports,Hurriyet Daily News,2026-05-30,8,Saturday,0.0,Neutral
Dre Greenlaw opens up about why 2025 season away from 49ers was so ‘real tough',sports,Nbcsportsbayarea.com,2026-05-30,8,Saturday,-0.197,Negative
Why Anthony Gordon Instantly Won Over Barcelona Fans At His Unveiling,sports,Forbes,2026-05-30,8,Saturday,0.5719,Positive
Wembley 99: Untold Stories,sports,Manchester City FC,2026-05-30,8,Saturday,0.0,Neutral
"UFC Fight Night odds, lines, predictions, time: Song Yadong vs. Deiveson Figueiredo picks by elite MMA expert",sports,CBS Sports,2026-05-30,8,Saturday,-0.3818,Negative
"How to Watch PSG vs. Arsenal Live Today: TV Channels, Streaming for Champions League Final",sports,Psgworld.io,2026-05-30,8,Saturday,0.5267,Positive
How Arteta's psychology rebuild took Arsenal to a Champions League final,sports,Sporting News,2026-05-30,8,Saturday,0.5267,Positive
How to watch Scotland vs Curacao match in the USA: Live Stream and TV for 2026 International Friendly,sports,Worldsoccertalk.com,2026-05-30,8,Saturday,0.4939,Positive
"How to watch PSG v Arsenal – team news, predicted line-ups and more",sports,Hayters.com,2026-05-30,8,Saturday,0.0,Neutral
Former Red Wings Captain to be Honored With Jersey Number Retirement Ceremony,sports,Detroithockeynow.com,2026-05-30,8,Saturday,0.6249,Positive
【DPC KOBE × TwoThree】整えるピラティス、楽しむピックル。女性限定コラボイベントを開催 6/8,sports,Prtimes.jp,2026-05-30,7,Saturday,0.0,Neutral
Robinhood Markets Bets on Agentic AI Trading as Assets Climb to $350 Billion,sports,MarketBeat,2026-05-30,7,Saturday,0.1779,Positive
"Inside Germany: Cheese rolling, grand slamming and a chancellor defamed",sports,The Local Germany,2026-05-30,7,Saturday,0.4588,Positive
"What channel is Thunder vs. Spurs on? Time, TV schedule, live stream to watch Game 7 of NBA Playoffs series",sports,Sporting News,2026-05-30,7,Saturday,0.0,Neutral
Zack Baun ready to find another level in Year 3 of Fangio's defense,sports,Nbcsportsphiladelphia.com,2026-05-30,7,Saturday,0.4588,Positive
These stylish Skullcandy headphones are undeniable quality cans but left me wanting more (or maybe less?),sports,Creative Bloq,2026-05-30,7,Saturday,0.0,Neutral
Walcott: Arteta is going to continue to dominate,sports,Sky Sports,2026-05-30,7,Saturday,-0.128,Negative
Jessica Alba's daughter Honor graduates: 'My heart aches with pride',sports,Nationpress.com,2026-05-30,6,Saturday,0.8316,Positive
Barcelona sign England winger Anthony Gordon from Newcastle,sports,Al Jazeera English,2026-05-30,6,Saturday,0.0,Neutral
