title,topic,source_name,date,hour,day_of_week,compound,sentiment_label
"‘Toy Story’ Franchise Will Change Forever Next Month, Fourth Movie To Be Taken Down",technology,Inside the Magic,2026-05-30,10,Saturday,0.0,Neutral
"G7 Agrees On Shared Language Around Open-Source AI, Open Weights AI",technology,Phoronix,2026-05-30,10,Saturday,0.4939,Positive
Why Energy Storage Is Quietly Becoming the Backbone of India’s EV Growth,technology,The Times of India,2026-05-30,10,Saturday,0.5719,Positive
Mercedes pulls out of Alpine F1 share talks over asking price,technology,autosport.com,2026-05-30,10,Saturday,0.296,Positive
Mercedes pulls out of Alpine F1 share talks over asking price,technology,Motorsport.com,2026-05-30,10,Saturday,0.296,Positive
Seagate Stock 2026: Buy or Sell as AI Data Storage Boom Drives Record Margins?,technology,Ibtimes.com.au,2026-05-30,10,Saturday,0.0,Neutral
Lumentum Stock 2026: Buy or Sell Amid Surging AI Optics Demand and Record Revenues?,technology,Ibtimes.com.au,2026-05-30,10,Saturday,-0.128,Negative
'Europe is kind of waking up': I went to Mistral's summit in Paris and heard a clear message about AI,technology,Business Insider,2026-05-30,10,Saturday,0.3818,Positive
A study reveals that the number of words people speak daily has decreased,technology,Gossiplankanews.com,2026-05-30,10,Saturday,0.0772,Positive
Cybercrime Crew Claims It Hacked Mike Lindell’s MyPillow,technology,Wired,2026-05-30,10,Saturday,-0.4019,Negative
Is VXUS Or VTI The Better Buy In An Uncertain Market?,technology,Forbes,2026-05-30,10,Saturday,0.1779,Positive
opencontext-profiles 1.0.1,technology,Pypi.org,2026-05-30,10,Saturday,0.0,Neutral
New 3D silicon chip breakthrough could extend Moore’s Law for years,technology,Science Daily,2026-05-30,10,Saturday,0.1779,Positive
Nvidia paid Groq $20 billion and took its top engineers. Now Groq is raising $650 million for what’s left.,technology,The Next Web,2026-05-30,10,Saturday,0.2023,Positive
"Tim Queeney: Rope’s strength comes from friction and the helix effect, its pivotal role in early societies, and the demand for real assets in modern technology | Odd Lots",technology,Crypto Briefing,2026-05-30,10,Saturday,0.2732,Positive
Xiaomi might have a 'Privacy Display' on the way that's all software,technology,Android Central,2026-05-30,10,Saturday,0.0,Neutral
What is US stock market prediction for Monday? Wall street ends at record highs as AI stocks and Dell lead market rally,technology,The Times of India,2026-05-30,10,Saturday,0.0,Neutral
This Trump-linked startup plans to put humanoid robots in the military,technology,CNBC,2026-05-30,10,Saturday,0.0,Neutral
"F&O Talk: Nifty may stay range-bound; Sudeep Shah sees opportunities in banks, IT, picks 7 stocks",technology,The Times of India,2026-05-30,10,Saturday,0.6486,Positive
"F&O Talk: Nifty may stay range-bound; Sudeep Shah sees opportunities in banks, IT, picks 7 stocks",technology,The Times of India,2026-05-30,10,Saturday,0.6486,Positive
Flopping Is Ethically Fine and Visually Atrocious,technology,New York Magazine,2026-05-30,10,Saturday,0.2023,Positive
China held advantageous position in negotiations with US,technology,Activistpost.com,2026-05-30,10,Saturday,0.3612,Positive
Why Now Is The Time For James Dolan To Sell A Stake In The Knicks,technology,Forbes,2026-05-30,10,Saturday,0.0,Neutral
"MakerWorld's First User-Initiated Charity Contest Names Winners, Bringing Global Creators' Goodwill Directly to Cancer Wards",technology,PRNewswire,2026-05-30,10,Saturday,0.128,Positive
Yale's New Google-Friendly Smart Lock Makes a Great Security Starter. Here's Why,technology,CNET,2026-05-30,10,Saturday,0.8481,Positive
Why Google’s Mid-Tier Gemini 3.5 Flash is Beating Top AI Models,technology,Geeky Gadgets,2026-05-30,10,Saturday,-0.296,Negative
How Riccio Pharmacy Makes Online Medicine Delivery Easier For Patients?,technology,GlobeNewswire,2026-05-30,10,Saturday,0.4215,Positive
"ICYMI: the 8 biggest tech stories of the week, from Oura's new smart ring to the Pope's take on AI",technology,TechRadar,2026-05-30,10,Saturday,0.4019,Positive
"In the 1960s an MIT scientist built ELIZA, a simple program that did little more than rephrase your words back as questions, and he was so unsettled when his own secretary asked him to leave the room so she could confide in it privately that he spent the rest of his life warning people against trusting machines with their feelings.",technology,Space Daily,2026-05-30,9,Saturday,-0.4388,Negative
"AI to reshape hiring and work in India, but 'human ownership' key as confidence outpaces global peers: ACCA",technology,BusinessLine,2026-05-30,9,Saturday,0.6652,Positive
$1.99 | Stillness Is the Key (eBook) by Ryan Holiday (2 replies),technology,Slickdeals.net,2026-05-30,9,Saturday,0.4019,Positive
I Run a Summer Camp. I Have One Piece of Advice for Parents Nervous About Sending Their Kids.,technology,Slate Magazine,2026-05-30,9,Saturday,-0.2732,Negative
One way companies are making AI backlash worse,technology,Business Insider,2026-05-30,9,Saturday,-0.4767,Negative
DroneAcharya reports FY26 profit of Rs 37 lakh despite 57% revenue slump,technology,MediaNama.com,2026-05-30,9,Saturday,0.4404,Positive
Perplexity is giving out tech's latest status symbol: a Mac Mini,technology,Business Insider,2026-05-30,9,Saturday,0.34,Positive
Quote of the day for work success by Steve Jobs: 'The only way to do great work is to...' What the Apple co-founder believed was the key to great achievement,technology,The Times of India,2026-05-30,9,Saturday,0.9169,Positive
Shalibhadra Finance eyes Rs 500 crore AUM as FY26 profit climbs 22%,technology,The Times of India,2026-05-30,9,Saturday,0.4404,Positive
"Rahul Gandhi targets Centre over CUET glitch, says 'not a single exam conducted honestly'",technology,The Times of India,2026-05-30,9,Saturday,0.4588,Positive
"Rahul Gandhi targets Centre over CUET glitch, says 'not a single exam conducted honestly'",technology,The Times of India,2026-05-30,9,Saturday,0.4588,Positive
Midnight Hammer F-16 pilots flew their non-stealth jets deep into Iran protecting bombers. Then they flew out critically low on fuel.,technology,Business Insider,2026-05-30,9,Saturday,-0.2732,Negative
What is oil price prediction for Monday? Oil prices fall as US-Iran ceasefire talks support market sentiment,technology,The Times of India,2026-05-30,9,Saturday,0.4019,Positive
It’s time for Samsung’s S Pen to evolve or die,technology,Android Authority,2026-05-30,9,Saturday,-0.5994,Negative
How a father’s solution to son’s Kannada homework became free keyboard app for 21 Indian languages,technology,The Indian Express,2026-05-30,9,Saturday,0.6808,Positive
Study unveils aggressive tobacco marketing targeting young African...,technology,Vmtnews.ng,2026-05-30,9,Saturday,-0.1531,Negative
Parabolic Semiconductor Rally: What Breaks The Trade?,technology,Realinvestmentadvice.com,2026-05-30,9,Saturday,0.0,Neutral
Russia uses networks in Finland to evade sanctions,technology,YLE News,2026-05-30,9,Saturday,0.0,Neutral
Reliance Digital is All Set to AI-fy India with the Boot Up 2026 Campaign,technology,BusinessLine,2026-05-30,9,Saturday,0.0,Neutral
I helped design the system that brought down ISIS financing. I’ve got an AI governance idea the Pope and Anthropic would both like,technology,Fortune,2026-05-30,9,Saturday,0.3612,Positive
Samsung Galaxy Z Roll 5G Leaks: A 12.4-Inch Motorized Screen and 324MP Camera?,technology,Geeky Gadgets,2026-05-30,9,Saturday,0.0,Neutral
Democrats Suddenly Have a Real Shot at Flipping the Senate,technology,New York Magazine,2026-05-30,9,Saturday,0.0,Neutral
"Circle freezes Zama’s USDC contract, locking $12.6M amid rug pull allegations",technology,Crypto Briefing,2026-05-30,9,Saturday,-0.0258,Neutral
You Wouldn’t Believe That “Quantum Energy” Works Until You Hear This & See THESE Photos.,technology,Omny.fm,2026-05-30,9,Saturday,0.0,Neutral
"Myanmar's Min Aung Hlaing takes first foreign tour as leader, with visit to India",technology,NPR,2026-05-30,9,Saturday,0.0,Neutral
Glenn Beck: Today’s tech could make Hitler look like a rookie — but what’s coming is far worse,technology,TheBlaze,2026-05-30,9,Saturday,-0.5267,Negative
"I've spent five decades researching UFOs and speaking to highly confidential sources. This is what I've discovered about the CIA, China and aliens, writes top barrister JONATHAN CAPLAN KC. You may scoff, but the evidence is undeniable",technology,Dailymail.com,2026-05-30,8,Saturday,0.1027,Positive
"Number of shares and votes in BioArctic AB (publ) as of May 29, 2026",technology,PRNewswire,2026-05-30,8,Saturday,0.3612,Positive
The class of 2026 might have to pivot in their job hunt,technology,Business Insider,2026-05-30,8,Saturday,0.0,Neutral
Ferrari’s former chairman called the Luce a disgrace. Italy’s transport minister piled on. The stock dropped 8%.,technology,The Next Web,2026-05-30,8,Saturday,-0.4939,Negative
Future Galaxy phones may get liquid cooling for more performance,technology,SamMobile,2026-05-30,8,Saturday,0.0,Neutral
A wind farm in Poland became so loud that local birds started singing louder to compete with the noise,technology,The Times of India,2026-05-30,8,Saturday,0.0,Neutral
An AI CEO explains how much he spent on Codex last month — and why he's still 'very nice' when prompting the tech,technology,Business Insider,2026-05-30,8,Saturday,0.4754,Positive
"Number of shares and votes in BioArctic AB (publ) as of May 29, 2026",technology,PRNewswire,2026-05-30,8,Saturday,0.3612,Positive
"In 1999, treasure hunters illegally dug up a strange disk in Germany, and it turned out to carry a 3,600-year-old map of the night sky",technology,The Times of India,2026-05-30,8,Saturday,0.1027,Positive
Odisha Signs $3.3B Semiconductor Pact With Intel & 3DGS,technology,Kalinga TV,2026-05-30,8,Saturday,0.0,Neutral
The future arrives at UHC's new 28-bed respiratory care unit,technology,Timeswv.com,2026-05-30,8,Saturday,0.4939,Positive
"Exclusive-Better China ties can help regional peace, security, Vietnam's top leader says",technology,Yahoo Entertainment,2026-05-30,8,Saturday,0.8555,Positive
Replenish Nutrients: Market Has Yet to Price in the H2 2026 Capacity and Licensing Inflection,technology,PRNewswire,2026-05-30,8,Saturday,0.0,Neutral
Social media bans for kids won’t replace platform safety — United Nations,technology,The Punch,2026-05-30,8,Saturday,0.6808,Positive
Europe Is Facing Up to a Painful Vulnerability to Drone Warfare,technology,Financial Post,2026-05-30,8,Saturday,-0.7184,Negative
DBRANLU VC represents India at prestigious IAFS-2026 conference in Bulgaria,technology,The Times of India,2026-05-30,8,Saturday,0.0,Neutral
"Henry Schein Sees Steady Dental Demand, $125M Profit Lift by 2026",technology,MarketBeat,2026-05-30,8,Saturday,0.34,Positive
These young people see bright future in trades but say stigma among obstacles in their way,technology,CBC News,2026-05-30,8,Saturday,-0.3506,Negative
007 First Light is a triumphant return to video games for James Bond,technology,CBC News,2026-05-30,8,Saturday,0.5267,Positive
Rebuilt cars are cheaper than other used vehicles. But it's buyer beware,technology,CBC News,2026-05-30,8,Saturday,0.0,Neutral
"MapmyIndia replaces Google Maps in Amazon Now, launches AI address verification for banks: Q4FY26",technology,MediaNama.com,2026-05-30,7,Saturday,0.1779,Positive
Dodgers host the Phillies on home winning streak,technology,Yahoo Entertainment,2026-05-30,7,Saturday,0.5267,Positive
Yankees bring 5-game win streak into matchup with the Athletics,technology,Yahoo Entertainment,2026-05-30,7,Saturday,0.5859,Positive
Mariners play the Diamondbacks leading series 1-0,technology,Yahoo Entertainment,2026-05-30,7,Saturday,0.34,Positive
Padres try to extend road win streak in matchup against the Nationals,technology,Yahoo Entertainment,2026-05-30,7,Saturday,0.6705,Positive
Brewers bring win streak into matchup with the Astros,technology,Yahoo Entertainment,2026-05-30,7,Saturday,0.5859,Positive
Braves bring 1-0 series lead over Reds into game 2,technology,Yahoo Entertainment,2026-05-30,7,Saturday,0.4404,Positive
Marlins take road slide into matchup with the Mets,technology,Yahoo Entertainment,2026-05-30,7,Saturday,0.0,Neutral
"White Sox host the Tigers, aim to extend home win streak",technology,Yahoo Entertainment,2026-05-30,7,Saturday,0.6705,Positive
"Otti promises people-oriented policies, responsible management of public resources",technology,The Punch,2026-05-30,7,Saturday,0.5994,Positive
Indonesia pushes innovation-led downstreaming for palm oil gains,technology,Antaranews.com,2026-05-30,7,Saturday,0.34,Positive
"Dan Loeb calls Nvidia reasonably valued at 15x forward earnings, dismisses AI bubble talk",technology,Crypto Briefing,2026-05-30,7,Saturday,0.4404,Positive
This strange new phase of matter could transform quantum technology,technology,Science Daily,2026-05-30,7,Saturday,-0.1779,Negative
Insurance Analytics Market Size to Hit USD 72.39 Billion by 2035 | Research by SNS Insider,technology,GlobeNewswire,2026-05-30,7,Saturday,0.0,Neutral
Japan pitches frigate export to New Zealand in 1st trilateral defense talks,technology,Japan Today,2026-05-30,7,Saturday,0.128,Positive
Reclusive 90s Hollywood star makes first appearance in 11 years on Toy Story 5 red carpet,technology,The-independent.com,2026-05-30,7,Saturday,0.0,Neutral
"Airbnb leases 46,000 sq ft for GCC in DLF Cyber City Gurugram",technology,Livemint,2026-05-30,7,Saturday,0.0,Neutral
11 equity mutual funds offer over 10% in May. Have you invested in any for your portfolio?,technology,Economictimes.com,2026-05-30,7,Saturday,0.0,Neutral
Robinhood Markets Bets on Agentic AI Trading as Assets Climb to $350 Billion,technology,MarketBeat,2026-05-30,7,Saturday,0.1779,Positive
"OpenAI has launched a massive $4 billion corporate engineering initiative called ""DeployCo"" to embed elite developers directly into global banks and enterprises",technology,Maketecheasier.com,2026-05-30,7,Saturday,0.128,Positive
"AI to reshape hiring and work in India, but 'human ownership' key as confidence outpaces global peers: ACCA",technology,The Times of India,2026-05-30,7,Saturday,0.6652,Positive
Berger Paints looks to strengthen presence in Uttar Pradesh,business,The Times of India,2026-05-30,10,Saturday,0.3182,Positive
Qatar Says Temporary Hormuz Fee to Clear Mines Is Negotiable,business,Financial Post,2026-05-30,10,Saturday,0.3818,Positive
NSSF pushes supplier diversity and long-term partnerships - The Observer,business,The Observer,2026-05-30,10,Saturday,0.0,Neutral
Pacsun's CEO breaks down the company's winning strategy to target Gen Z,business,Business Insider,2026-05-30,10,Saturday,0.5267,Positive
"Bicycles and Their Practical Use in Prepping, by Tunnel Rabbit",business,Survivalblog.com,2026-05-30,10,Saturday,0.0,Neutral
Dine and dash couple are almost caught fleeing a fish and chip shop without paying the £45 bill... when their children aren't in on the act,business,Dailymail.com,2026-05-30,10,Saturday,0.0,Neutral
Son Hyun Joo Suddenly Announces Retirement And Sparks A Fierce Succession Battle In “Reborn Rookie”,business,soompi,2026-05-30,10,Saturday,-0.2023,Negative
Canyon-SRAM drop cryptocurrency sponsor following “breaches of contract” and a criminal investigation,business,road.cc,2026-05-30,10,Saturday,-0.6705,Negative
Judge Gives Green Light For Feds to Seize Money From Kwame Kilpatrick's Wife's Business Account,business,Freerepublic.com,2026-05-30,10,Saturday,0.0,Neutral
Lumentum Stock 2026: Buy or Sell Amid Surging AI Optics Demand and Record Revenues?,business,Ibtimes.com.au,2026-05-30,10,Saturday,-0.128,Negative
'Europe is kind of waking up': I went to Mistral's summit in Paris and heard a clear message about AI,business,Business Insider,2026-05-30,10,Saturday,0.3818,Positive
10 Weekend Reads,business,Ritholtz.com,2026-05-30,10,Saturday,0.0,Neutral
Nvidia paid Groq $20 billion and took its top engineers. Now Groq is raising $650 million for what’s left.,business,The Next Web,2026-05-30,10,Saturday,0.2023,Positive
"Parloa turns its $350 million war chest into a partnership web spanning SAP, Microsoft, and OpenAI",business,The Next Web,2026-05-30,10,Saturday,-0.5994,Negative
Why the Protect College Sports Act is the best thing for college sports,business,A Sea Of Blue,2026-05-30,10,Saturday,0.7783,Positive
"At $55M, Mamdani’s city-owned grocery store is a GROWING boondoggle",business,New York Post,2026-05-30,10,Saturday,0.347,Positive
"Naomi Osaka arrives for French Open match in billowing dress as she refuses to back down AGAIN on wearing 'fashion show' outfits, despite infuriating opponent",business,Dailymail.com,2026-05-30,10,Saturday,0.4168,Positive
Mango founder's son releases video of his billionaire father falling over as he battles claim that his father's fatal mountain plunge was no accident,business,Dailymail.com,2026-05-30,10,Saturday,-0.6305,Negative
Cavaliers make right call with coach Kenny Atkinson's job. Opinion,business,Akron Beacon Journal,2026-05-30,10,Saturday,0.0,Neutral
FSSAI sends notice to IRCTC after viral video shows utensils being washed in train toilet,business,The Times of India,2026-05-30,10,Saturday,0.0,Neutral
Want to Watch a James Bond Movie? These Are My Top Picks,business,CNET,2026-05-30,10,Saturday,0.2732,Positive
Amy Gaskin: Marilyn Forever! Marilyn Monroe—A Symbol of Hope,business,Lenscratch.com,2026-05-30,10,Saturday,0.4926,Positive
President of Myanmar’s military-backed government visits India,business,Abcnews.com,2026-05-30,10,Saturday,0.0,Neutral
Flopping Is Ethically Fine and Visually Atrocious,business,New York Magazine,2026-05-30,10,Saturday,0.2023,Positive
When the Religious Right Came for Martin Scorsese,business,The New Yorker,2026-05-30,10,Saturday,0.0,Neutral
Why Now Is The Time For James Dolan To Sell A Stake In The Knicks,business,Forbes,2026-05-30,10,Saturday,0.0,Neutral
Google Titan Security Key,business,PCMag.com,2026-05-30,10,Saturday,0.34,Positive
Flesh-Eating Bacteria in Hamptons Water: Oystermen Dispute Scientists' Claims,business,Vanity Fair,2026-05-30,10,Saturday,-0.4019,Negative
Paramount founder Mohamad Fakih opens up about his feud with Mississauga’s mayor,business,Toronto Star,2026-05-30,9,Saturday,-0.34,Negative
We did the math on Ken Griffin's pied-à-terre tax bill,business,Business Insider,2026-05-30,9,Saturday,0.0,Neutral
Cutting-edge underwater tech for AUKUS forces to be developed through landmark partnership,business,Www.gov.uk,2026-05-30,9,Saturday,0.0772,Positive
Triveni Engineering Q4 profit falls to Rs 167.4 crore; FY26 profit rises 12.8%,business,The Times of India,2026-05-30,9,Saturday,0.7003,Positive
Triveni Engineering Q4 profit falls to Rs 167.4 crore; FY26 profit rises 12.8%,business,The Times of India,2026-05-30,9,Saturday,0.7003,Positive
One way companies are making AI backlash worse,business,Business Insider,2026-05-30,9,Saturday,-0.4767,Negative
Nepal Tourism Promotion Program held in Bangkok,business,Khabarhub.com,2026-05-30,9,Saturday,0.0,Neutral
Perplexity is giving out tech's latest status symbol: a Mac Mini,business,Business Insider,2026-05-30,9,Saturday,0.34,Positive
Quote of the day for work success by Steve Jobs: 'The only way to do great work is to...' What the Apple co-founder believed was the key to great achievement,business,The Times of India,2026-05-30,9,Saturday,0.9169,Positive
Think. Over the week,business,BusinessLine,2026-05-30,9,Saturday,0.0,Neutral
Influencer banned from Six Flags for life after sneaking McDonald’s snack onto roller coaster,business,The-independent.com,2026-05-30,9,Saturday,-0.4588,Negative
A couple got burned out pursuing FIRE. They found another path that let them cut back at work and still enjoy life.,business,Business Insider,2026-05-30,9,Saturday,-0.2577,Negative
"New Xbox Boss Says Decision to Continue to Show PS5 Logos During Its Xbox Games Showcase 'Was a Miss, and I Own It'",business,IGN,2026-05-30,9,Saturday,-0.1531,Negative
I became a trailing spouse when I moved to Europe for my husband. I don't regret putting my family before my career.,business,Business Insider,2026-05-30,9,Saturday,0.3252,Positive
NSE Social Stock Exchange gets CSR boost as MCA clears corporate funding route. Check details,business,The Times of India,2026-05-30,9,Saturday,0.4588,Positive
Midnight Hammer F-16 pilots flew their non-stealth jets deep into Iran protecting bombers. Then they flew out critically low on fuel.,business,Business Insider,2026-05-30,9,Saturday,-0.2732,Negative
"For a match made in retail heaven, friction on earth can be real",business,The Times of India,2026-05-30,9,Saturday,0.5106,Positive
"They used to work for Wall Street banks — now they charge those same firms $25,000 a day to teach them AI",business,Yahoo Entertainment,2026-05-30,9,Saturday,0.0,Neutral
"In 1859, Robert Chesebrough saw oil workers scraping sticky rod wax from drilling rigs, and it wasn’t just waste: It became Vaseline",business,The Times of India,2026-05-30,9,Saturday,-0.4215,Negative
How a father’s solution to son’s Kannada homework became free keyboard app for 21 Indian languages,business,The Indian Express,2026-05-30,9,Saturday,0.6808,Positive
"'Happier now': Woman quits 9-year IT manager job to become rickshaw driver, says she found more peace earning Rs 60,000 a month",business,The Times of India,2026-05-30,9,Saturday,0.8016,Positive
"After a Near-Fatal Run-In With a Reckless Driver, This Man Devised a Clever Way to Get Revenge",business,Twistedsifter.com,2026-05-30,9,Saturday,-0.4767,Negative
"PB Fintech founders Yashish Dahiya, Alok Bansal sell 0.8% stake worth Rs 665 crore",business,The Times of India,2026-05-30,9,Saturday,0.2263,Positive
Reliance Digital is All Set to AI-fy India with the Boot Up 2026 Campaign,business,BusinessLine,2026-05-30,9,Saturday,0.0,Neutral
India Says Inflation Outlook Needs Vigilance Ahead of RBI Policy,business,Financial Post,2026-05-30,9,Saturday,0.0,Neutral
"I spent the day at 'Substack Coachella,' which was full of panels, partying, and old-school magazine vibes",business,Business Insider,2026-05-30,9,Saturday,0.3818,Positive
I'm the founder of a soju brand and the chair of the LACMA Art + Film Gala. I work between Seoul and LA and rarely sleep before 3 a.m.,business,Business Insider,2026-05-30,9,Saturday,0.0,Neutral
Texas Tech signs latest House settlement participant agreement,business,LubbockOnline.com,2026-05-30,9,Saturday,0.4939,Positive
"Adidas and Puma, the bitter rivalry between two brothers",business,Mrssfeed.com,2026-05-30,9,Saturday,-0.4215,Negative
Democrats Suddenly Have a Real Shot at Flipping the Senate,business,New York Magazine,2026-05-30,9,Saturday,0.0,Neutral
NotebookLM is quickly becoming the podcast app I didn’t know I needed,business,Android Authority,2026-05-30,9,Saturday,0.0,Neutral
"Myanmar's Min Aung Hlaing takes first foreign tour as leader, with visit to India",business,NPR,2026-05-30,9,Saturday,0.0,Neutral
How three major candidates for governor are talking about their Biden administration experience,business,NBC News,2026-05-30,9,Saturday,0.0,Neutral
Differences under Jeff Hafley – The Splash Zone 5/30/26,business,The Phinsider,2026-05-30,9,Saturday,0.0,Neutral
New project aims to preserve Halifax's skateboard history in public archive,business,CBC News,2026-05-30,9,Saturday,0.0,Neutral
Designing The Perfect Final Season For Everyone’s Favorite ‘Hacks’,business,Forbes,2026-05-30,9,Saturday,0.7717,Positive
Government withdraws right to appeal against some short stay visa refusals,business,TheJournal.ie,2026-05-30,8,Saturday,0.0,Neutral
This run-down town is the launchpad for the superweapon Putin used to attack Ukraine,business,Business Insider,2026-05-30,8,Saturday,-0.4767,Negative
The Rumour Mill - Close Season Week 1,business,Toffeeweb,2026-05-30,8,Saturday,0.0,Neutral
The class of 2026 might have to pivot in their job hunt,business,Business Insider,2026-05-30,8,Saturday,0.0,Neutral
12B SPORTS Named Main Sponsor of VR46 Racing Team for the 2026 MotoGP Season,business,Financial Post,2026-05-30,8,Saturday,0.0,Neutral
"No IIT, no mentor: Techie who survived on 1–2 samosas a day & started with just Rs 20,000 a month reveals how he rose to become one of youngest VPs",business,The Times of India,2026-05-30,8,Saturday,0.4567,Positive
Ferrari’s former chairman called the Luce a disgrace. Italy’s transport minister piled on. The stock dropped 8%.,business,The Next Web,2026-05-30,8,Saturday,-0.4939,Negative
Does XRP (Ripple) Have Any Future After 2026?,business,24/7 Wall St.,2026-05-30,8,Saturday,0.0,Neutral
What your driveway says about you: From 'shouty' electric gates to 'new money' resin designs - as a home expert reveals the 'timeless' option that proves you have taste,business,Dailymail.com,2026-05-30,8,Saturday,0.0,Neutral
Rúben Dias breaks his silence on split from Maya Jama and insists he 'did not cheat',business,LADbible,2026-05-30,8,Saturday,0.357,Positive
An AI CEO explains how much he spent on Codex last month — and why he's still 'very nice' when prompting the tech,business,Business Insider,2026-05-30,8,Saturday,0.4754,Positive
North Atlantic Refining wind-hydrogen project takes key step with environmental release,business,CBC News,2026-05-30,8,Saturday,0.0,Neutral
Meet Anas Laghrari – The mystery man behind Florentino Perez at the centre of Real Madrid elections,business,Madriduniversal.com,2026-05-30,8,Saturday,0.0,Neutral
"A new business card, not a better career: Why employees in US are losing faith in corporate promotions",business,The Times of India,2026-05-30,8,Saturday,-0.2973,Negative
Red Lobster closing Times Square location after 23 years: ‘This was a difficult decision’,business,New York Post,2026-05-30,8,Saturday,-0.3612,Negative
